{
  "schema_version": 1,
  "node_id": "NRPC-N1-02",
  "node_title": "Deadline / Cancel / Exactly-Once Completion",
  "source_plan_version": "0.4-simple-mainline",
  "source_section": "§4.2",
  "compiler": {
    "type": "LearningCI 简化执行包生成器",
    "status": "REVIEWED",
    "note": "v0.4 默认执行包已可直接开始；只有节点确实过大或边界不清时才使用节点准备重新细化。"
  },
  "task_policy": {
    "single_active_leaf_task": true,
    "leaf_tasks_required_for_verification": true,
    "parent_progress_is_derived": true,
    "paper_visible_before_tasks_complete": true
  },
  "task_groups": [
    {
      "id": "main",
      "title": "Deadline / Cancel / Exactly-Once Completion · 主任务",
      "description": "保持节点完整，不再人为拆成二三十个碎片任务。",
      "items": [
        {
          "id": "NRPC-N1-02-T01",
          "title": "设计统一 CompletionState 与终态迁移规则",
          "detail": "设计统一 CompletionState 与终态迁移规则",
          "purpose": "让 Response、Timeout、Cancel、Connection Close 等完成源竞争时，一个 RPC 只能进入一次终态，并能正确清理 PendingCall。",
          "estimated_minutes": 40,
          "required": true,
          "evidence_required": true,
          "evidence_fields": [
            "source_path",
            "function_name",
            "note"
          ],
          "done_when": [
            "完成该动作本身",
            "留下足以复核结果的最小证据"
          ]
        },
        {
          "id": "NRPC-N1-02-T02",
          "title": "接入 absolute deadline / timer 完成源",
          "detail": "接入 absolute deadline / timer 完成源",
          "purpose": "让 Response、Timeout、Cancel、Connection Close 等完成源竞争时，一个 RPC 只能进入一次终态，并能正确清理 PendingCall。",
          "estimated_minutes": 40,
          "required": true,
          "evidence_required": true,
          "evidence_fields": [
            "source_path",
            "function_name",
            "note"
          ],
          "done_when": [
            "完成该动作本身",
            "留下足以复核结果的最小证据"
          ]
        },
        {
          "id": "NRPC-N1-02-T03",
          "title": "实现 cancel、late response、connection close 的竞争处理",
          "detail": "实现 cancel、late response、connection close 的竞争处理",
          "purpose": "让 Response、Timeout、Cancel、Connection Close 等完成源竞争时，一个 RPC 只能进入一次终态，并能正确清理 PendingCall。",
          "estimated_minutes": 40,
          "required": true,
          "evidence_required": true,
          "evidence_fields": [
            "source_path",
            "function_name",
            "note"
          ],
          "done_when": [
            "完成该动作本身",
            "留下足以复核结果的最小证据"
          ]
        },
        {
          "id": "NRPC-N1-02-T04",
          "title": "建立 race/fault tests 验证 exactly-once completion 和资源清理",
          "detail": "建立 race/fault tests 验证 exactly-once completion 和资源清理",
          "purpose": "让 Response、Timeout、Cancel、Connection Close 等完成源竞争时，一个 RPC 只能进入一次终态，并能正确清理 PendingCall。",
          "estimated_minutes": 40,
          "required": true,
          "evidence_required": true,
          "evidence_fields": [
            "source_path",
            "function_name",
            "note"
          ],
          "done_when": [
            "完成该动作本身",
            "留下足以复核结果的最小证据"
          ]
        },
        {
          "id": "NRPC-N1-02-V01",
          "title": "运行针对性测试并保留失败/修复证据",
          "detail": "运行针对性测试并保留失败/修复证据",
          "purpose": "让 Response、Timeout、Cancel、Connection Close 等完成源竞争时，一个 RPC 只能进入一次终态，并能正确清理 PendingCall。",
          "estimated_minutes": 20,
          "required": true,
          "evidence_required": true,
          "evidence_fields": [
            "source_path",
            "function_name",
            "note"
          ],
          "done_when": [
            "完成该动作本身",
            "留下足以复核结果的最小证据"
          ]
        }
      ]
    }
  ],
  "task_count": 5,
  "verification_paper": {
    "paper_id": "NRPC-N1-02-V1",
    "version": 1,
    "visible_from_start": true,
    "frozen": true,
    "questions": [
      {
        "id": "q1",
        "dimension": "explanation",
        "max_score": 15,
        "question": "解释 Deadline / Cancel / Exactly-Once Completion 的核心机制和边界，覆盖：exactly-once completion；absolute deadline；cancel/late response；race handling。重点说明因果关系，不背术语。"
      },
      {
        "id": "q2",
        "dimension": "prediction",
        "max_score": 15,
        "question": "给当前能力制造一个新的时序、并发或故障变化，在运行前预测关键状态和失败点。不得进入：复杂分布式重试；协程 API 美化。"
      },
      {
        "id": "q3",
        "dimension": "implementation",
        "max_score": 25,
        "question": "提交真实工程结果。锚点：nebula/rpc/、nebula/base/timer*、tests/completion/。必须附复现步骤和至少一种证据：状态机代码、race tests、故障日志、Sanitizer。"
      },
      {
        "id": "q4",
        "dimension": "diagnosis",
        "max_score": 25,
        "question": "从本节点真实运行中选择一个故障/边界，按观察→假设→证据→根因→修复→再验证完成诊断。"
      },
      {
        "id": "q5",
        "dimension": "transfer",
        "max_score": 20,
        "question": "把“让 Response、Timeout、Cancel、Connection Close 等完成源竞争时，一个 RPC 只能进入一次终态，并能正确清理 PendingCall。”迁移到一个训练任务未原样出现的新场景，说明不变原则、需要调整的实现与取舍。"
      }
    ]
  },
  "retest_policy": {
    "reuse_initial_verification_for_failed_attempts": true,
    "new_paper_required_for_retest": true,
    "retest_paper_must_change_scenario": true
  }
}
