{
  "schema_version": 1,
  "node_id": "NRPC-N5-01",
  "node_title": "Benchmark / Profile / 性能优化闭环",
  "source_plan_version": "0.4-simple-mainline",
  "source_section": "§8.1",
  "compiler": {
    "type": "LearningCI 简化执行包生成器",
    "status": "REVIEWED",
    "note": "v0.4 默认执行包已可直接开始；只有节点确实过大或边界不清时才使用节点准备重新细化。"
  },
  "task_policy": {
    "single_active_leaf_task": true,
    "leaf_tasks_required_for_verification": true,
    "parent_progress_is_derived": true,
    "paper_visible_before_tasks_complete": true
  },
  "task_groups": [
    {
      "id": "main",
      "title": "Benchmark / Profile / 性能优化闭环 · 主任务",
      "description": "保持节点完整，不再人为拆成二三十个碎片任务。",
      "items": [
        {
          "id": "NRPC-N5-01-T01",
          "title": "固定机器、Release 参数、payload、并发、连接数、warm-up 与测试时长",
          "detail": "固定机器、Release 参数、payload、并发、连接数、warm-up 与测试时长",
          "purpose": "建立可靠性能基线，使用 perf/flamegraph 等工具定位真实热点，并至少完成一个有效优化和一个失败优化回退案例。",
          "estimated_minutes": 30,
          "required": true,
          "evidence_required": true,
          "evidence_fields": [
            "source_path",
            "function_name",
            "note"
          ],
          "done_when": [
            "完成该动作本身",
            "留下足以复核结果的最小证据"
          ]
        },
        {
          "id": "NRPC-N5-01-T02",
          "title": "记录 QPS、P50/P99/P999、CPU、内存和线程等 baseline",
          "detail": "记录 QPS、P50/P99/P999、CPU、内存和线程等 baseline",
          "purpose": "建立可靠性能基线，使用 perf/flamegraph 等工具定位真实热点，并至少完成一个有效优化和一个失败优化回退案例。",
          "estimated_minutes": 30,
          "required": true,
          "evidence_required": true,
          "evidence_fields": [
            "source_path",
            "function_name",
            "note"
          ],
          "done_when": [
            "完成该动作本身",
            "留下足以复核结果的最小证据"
          ]
        },
        {
          "id": "NRPC-N5-01-T03",
          "title": "使用 perf/flamegraph 定位热点并完成至少一个有数据支撑的优化",
          "detail": "使用 perf/flamegraph 定位热点并完成至少一个有数据支撑的优化",
          "purpose": "建立可靠性能基线，使用 perf/flamegraph 等工具定位真实热点，并至少完成一个有效优化和一个失败优化回退案例。",
          "estimated_minutes": 30,
          "required": true,
          "evidence_required": true,
          "evidence_fields": [
            "source_path",
            "function_name",
            "note"
          ],
          "done_when": [
            "完成该动作本身",
            "留下足以复核结果的最小证据"
          ]
        },
        {
          "id": "NRPC-N5-01-T04",
          "title": "保留至少一个没有收益或有副作用的优化实验及回退原因",
          "detail": "保留至少一个没有收益或有副作用的优化实验及回退原因",
          "purpose": "建立可靠性能基线，使用 perf/flamegraph 等工具定位真实热点，并至少完成一个有效优化和一个失败优化回退案例。",
          "estimated_minutes": 30,
          "required": true,
          "evidence_required": true,
          "evidence_fields": [
            "source_path",
            "function_name",
            "note"
          ],
          "done_when": [
            "完成该动作本身",
            "留下足以复核结果的最小证据"
          ]
        },
        {
          "id": "NRPC-N5-01-V01",
          "title": "保存可复现命令、原始数据与结论",
          "detail": "保存可复现命令、原始数据与结论",
          "purpose": "建立可靠性能基线，使用 perf/flamegraph 等工具定位真实热点，并至少完成一个有效优化和一个失败优化回退案例。",
          "estimated_minutes": 20,
          "required": true,
          "evidence_required": true,
          "evidence_fields": [
            "source_path",
            "function_name",
            "note"
          ],
          "done_when": [
            "完成该动作本身",
            "留下足以复核结果的最小证据"
          ]
        }
      ]
    }
  ],
  "task_count": 5,
  "verification_paper": {
    "paper_id": "NRPC-N5-01-V1",
    "version": 1,
    "visible_from_start": true,
    "frozen": true,
    "questions": [
      {
        "id": "q1",
        "dimension": "explanation",
        "max_score": 15,
        "question": "解释 Benchmark / Profile / 性能优化闭环 的核心机制和边界，覆盖：reproducible benchmark；profile-driven optimization；tail latency；failed optimization evidence。重点说明因果关系，不背术语。"
      },
      {
        "id": "q2",
        "dimension": "prediction",
        "max_score": 15,
        "question": "给当前能力制造一个新的时序、并发或故障变化，在运行前预测关键状态和失败点。不得进入：没有 profile 就做对象池/零拷贝；只晒单次跑分。"
      },
      {
        "id": "q3",
        "dimension": "implementation",
        "max_score": 25,
        "question": "提交真实工程结果。锚点：benchmark/、docs/benchmark/、docs/performance/。必须附复现步骤和至少一种证据：原始数据、命令、profile、前后对比、Git commit。"
      },
      {
        "id": "q4",
        "dimension": "diagnosis",
        "max_score": 25,
        "question": "从本节点真实运行中选择一个故障/边界，按观察→假设→证据→根因→修复→再验证完成诊断。"
      },
      {
        "id": "q5",
        "dimension": "transfer",
        "max_score": 20,
        "question": "把“建立可靠性能基线，使用 perf/flamegraph 等工具定位真实热点，并至少完成一个有效优化和一个失败优化回退案例。”迁移到一个训练任务未原样出现的新场景，说明不变原则、需要调整的实现与取舍。"
      }
    ]
  },
  "retest_policy": {
    "reuse_initial_verification_for_failed_attempts": true,
    "new_paper_required_for_retest": true,
    "retest_paper_must_change_scenario": true
  }
}
