{
  "schema_version": 1,
  "node_id": "NRPC-R0-02",
  "node_title": "快速回顾 game_rpc_project RPC 链路",
  "source_plan_version": "0.4-simple-mainline",
  "source_section": "§2.2",
  "compiler": {
    "type": "LearningCI 简化执行包生成器",
    "status": "REVIEWED",
    "note": "v0.4 默认执行包已可直接开始；只有节点确实过大或边界不清时才使用节点准备重新细化。"
  },
  "task_policy": {
    "single_active_leaf_task": true,
    "leaf_tasks_required_for_verification": true,
    "parent_progress_is_derived": true,
    "paper_visible_before_tasks_complete": true
  },
  "task_groups": [
    {
      "id": "main",
      "title": "快速回顾 game_rpc_project RPC 链路 · 主任务",
      "description": "保持节点完整，不再人为拆成二三十个碎片任务。",
      "items": [
        {
          "id": "NRPC-R0-02-T01",
          "title": "回看请求编码、消息边界与增量解析",
          "detail": "回看请求编码、消息边界与增量解析",
          "purpose": "能够重新说清旧 RPC 的协议、Protobuf Service 分发、RequestId/PendingCall、promise/future 与收包线程模型，并明确它与真正异步 RPC 的差距。",
          "estimated_minutes": 20,
          "required": true,
          "evidence_required": true,
          "evidence_fields": [
            "source_path",
            "function_name",
            "note"
          ],
          "done_when": [
            "完成该动作本身",
            "留下足以复核结果的最小证据"
          ]
        },
        {
          "id": "NRPC-R0-02-T02",
          "title": "回看 RpcProvider/Service 分发与响应编码",
          "detail": "回看 RpcProvider/Service 分发与响应编码",
          "purpose": "能够重新说清旧 RPC 的协议、Protobuf Service 分发、RequestId/PendingCall、promise/future 与收包线程模型，并明确它与真正异步 RPC 的差距。",
          "estimated_minutes": 20,
          "required": true,
          "evidence_required": true,
          "evidence_fields": [
            "source_path",
            "function_name",
            "note"
          ],
          "done_when": [
            "完成该动作本身",
            "留下足以复核结果的最小证据"
          ]
        },
        {
          "id": "NRPC-R0-02-T03",
          "title": "回看 RequestId、PendingCall、promise/future 的请求响应匹配",
          "detail": "回看 RequestId、PendingCall、promise/future 的请求响应匹配",
          "purpose": "能够重新说清旧 RPC 的协议、Protobuf Service 分发、RequestId/PendingCall、promise/future 与收包线程模型，并明确它与真正异步 RPC 的差距。",
          "estimated_minutes": 20,
          "required": true,
          "evidence_required": true,
          "evidence_fields": [
            "source_path",
            "function_name",
            "note"
          ],
          "done_when": [
            "完成该动作本身",
            "留下足以复核结果的最小证据"
          ]
        },
        {
          "id": "NRPC-R0-02-T04",
          "title": "回看 ReceiverThread/wait_for 模型并指出后续必须替换的同步阻塞点",
          "detail": "回看 ReceiverThread/wait_for 模型并指出后续必须替换的同步阻塞点",
          "purpose": "能够重新说清旧 RPC 的协议、Protobuf Service 分发、RequestId/PendingCall、promise/future 与收包线程模型，并明确它与真正异步 RPC 的差距。",
          "estimated_minutes": 20,
          "required": true,
          "evidence_required": true,
          "evidence_fields": [
            "source_path",
            "function_name",
            "note"
          ],
          "done_when": [
            "完成该动作本身",
            "留下足以复核结果的最小证据"
          ]
        },
        {
          "id": "NRPC-R0-02-V01",
          "title": "确认达到能解释、能修改、能调试",
          "detail": "确认达到能解释、能修改、能调试",
          "purpose": "能够重新说清旧 RPC 的协议、Protobuf Service 分发、RequestId/PendingCall、promise/future 与收包线程模型，并明确它与真正异步 RPC 的差距。",
          "estimated_minutes": 20,
          "required": true,
          "evidence_required": true,
          "evidence_fields": [
            "source_path",
            "function_name",
            "note"
          ],
          "done_when": [
            "完成该动作本身",
            "留下足以复核结果的最小证据"
          ]
        }
      ]
    }
  ],
  "task_count": 5,
  "verification_paper": {
    "paper_id": "NRPC-R0-02-V1",
    "version": 1,
    "visible_from_start": true,
    "frozen": true,
    "questions": [
      {
        "id": "q1",
        "dimension": "explanation",
        "max_score": 15,
        "question": "解释 快速回顾 game_rpc_project RPC 链路 的核心机制和边界，覆盖：TCP 消息边界；Protobuf Service dispatch；RequestId/PendingCall；promise/future；ReceiverThread/wait_for 局限。重点说明因果关系，不背术语。"
      },
      {
        "id": "q2",
        "dimension": "prediction",
        "max_score": 15,
        "question": "给当前能力制造一个新的时序、并发或故障变化，在运行前预测关键状态和失败点。不得进入：重写旧 RPC；提前实现协程；写历史总结报告。"
      },
      {
        "id": "q3",
        "dimension": "implementation",
        "max_score": 25,
        "question": "提交真实工程结果。锚点：../game_rpc_project/。必须附复现步骤和至少一种证据：真实源码位置、已有测试/运行结果、调用链解释。"
      },
      {
        "id": "q4",
        "dimension": "diagnosis",
        "max_score": 25,
        "question": "从本节点真实运行中选择一个故障/边界，按观察→假设→证据→根因→修复→再验证完成诊断。"
      },
      {
        "id": "q5",
        "dimension": "transfer",
        "max_score": 20,
        "question": "把“能够重新说清旧 RPC 的协议、Protobuf Service 分发、RequestId/PendingCall、promise/future 与收包线程模型，并明确它与真正异步 RPC 的差距。”迁移到一个训练任务未原样出现的新场景，说明不变原则、需要调整的实现与取舍。"
      }
    ]
  },
  "retest_policy": {
    "reuse_initial_verification_for_failed_attempts": true,
    "new_paper_required_for_retest": true,
    "retest_paper_must_change_scenario": true
  }
}
