{
  "schema_version": 1,
  "node_id": "NRPC-FINAL-01",
  "node_title": "NebulaRPC v1.0 求职证据收束",
  "source_plan_version": "0.4-simple-mainline",
  "source_section": "§9",
  "compiler": {
    "type": "LearningCI 简化执行包生成器",
    "status": "REVIEWED",
    "note": "v0.4 默认执行包已可直接开始；只有节点确实过大或边界不清时才使用节点准备重新细化。"
  },
  "task_policy": {
    "single_active_leaf_task": true,
    "leaf_tasks_required_for_verification": true,
    "parent_progress_is_derived": true,
    "paper_visible_before_tasks_complete": true
  },
  "task_groups": [
    {
      "id": "main",
      "title": "NebulaRPC v1.0 求职证据收束 · 主任务",
      "description": "保持节点完整，不再人为拆成二三十个碎片任务。",
      "items": [
        {
          "id": "NRPC-FINAL-01-T01",
          "title": "整理 README、Architecture、关键状态机/时序图与 build/run 指南",
          "detail": "整理 README、Architecture、关键状态机/时序图与 build/run 指南",
          "purpose": "把项目整理成可被 15~20k C++ 后端岗位追问和复现的技术作品：源码、测试、Benchmark、ADR、失败案例与面试叙事能够互相对应。",
          "estimated_minutes": 30,
          "required": true,
          "evidence_required": true,
          "evidence_fields": [
            "source_path",
            "function_name",
            "note"
          ],
          "done_when": [
            "完成该动作本身",
            "留下足以复核结果的最小证据"
          ]
        },
        {
          "id": "NRPC-FINAL-01-T02",
          "title": "为核心能力绑定 Git commit、测试、故障证据、benchmark/profile 证据",
          "detail": "为核心能力绑定 Git commit、测试、故障证据、benchmark/profile 证据",
          "purpose": "把项目整理成可被 15~20k C++ 后端岗位追问和复现的技术作品：源码、测试、Benchmark、ADR、失败案例与面试叙事能够互相对应。",
          "estimated_minutes": 30,
          "required": true,
          "evidence_required": true,
          "evidence_fields": [
            "source_path",
            "function_name",
            "note"
          ],
          "done_when": [
            "完成该动作本身",
            "留下足以复核结果的最小证据"
          ]
        },
        {
          "id": "NRPC-FINAL-01-T03",
          "title": "准备 60 秒项目介绍与 5 分钟深挖路径，覆盖网络/并发/协程/可靠性/性能取舍",
          "detail": "准备 60 秒项目介绍与 5 分钟深挖路径，覆盖网络/并发/协程/可靠性/性能取舍",
          "purpose": "把项目整理成可被 15~20k C++ 后端岗位追问和复现的技术作品：源码、测试、Benchmark、ADR、失败案例与面试叙事能够互相对应。",
          "estimated_minutes": 30,
          "required": true,
          "evidence_required": true,
          "evidence_fields": [
            "source_path",
            "function_name",
            "note"
          ],
          "done_when": [
            "完成该动作本身",
            "留下足以复核结果的最小证据"
          ]
        },
        {
          "id": "NRPC-FINAL-01-T04",
          "title": "从干净环境复现 build、tests、benchmark smoke 并打 v1.0 tag",
          "detail": "从干净环境复现 build、tests、benchmark smoke 并打 v1.0 tag",
          "purpose": "把项目整理成可被 15~20k C++ 后端岗位追问和复现的技术作品：源码、测试、Benchmark、ADR、失败案例与面试叙事能够互相对应。",
          "estimated_minutes": 30,
          "required": true,
          "evidence_required": true,
          "evidence_fields": [
            "source_path",
            "function_name",
            "note"
          ],
          "done_when": [
            "完成该动作本身",
            "留下足以复核结果的最小证据"
          ]
        },
        {
          "id": "NRPC-FINAL-01-V01",
          "title": "保存可复现命令、原始数据与结论",
          "detail": "保存可复现命令、原始数据与结论",
          "purpose": "把项目整理成可被 15~20k C++ 后端岗位追问和复现的技术作品：源码、测试、Benchmark、ADR、失败案例与面试叙事能够互相对应。",
          "estimated_minutes": 20,
          "required": true,
          "evidence_required": true,
          "evidence_fields": [
            "source_path",
            "function_name",
            "note"
          ],
          "done_when": [
            "完成该动作本身",
            "留下足以复核结果的最小证据"
          ]
        }
      ]
    }
  ],
  "task_count": 5,
  "verification_paper": {
    "paper_id": "NRPC-FINAL-01-V1",
    "version": 1,
    "visible_from_start": true,
    "frozen": true,
    "questions": [
      {
        "id": "q1",
        "dimension": "explanation",
        "max_score": 15,
        "question": "解释 NebulaRPC v1.0 求职证据收束 的核心机制和边界，覆盖：problem->constraint->design->code->verification->data->tradeoff；可复现证据；面试深挖；版本封板。重点说明因果关系，不背术语。"
      },
      {
        "id": "q2",
        "dimension": "prediction",
        "max_score": 15,
        "question": "给当前能力制造一个新的时序、并发或故障变化，在运行前预测关键状态和失败点。不得进入：继续堆无关功能；只写漂亮 README 不保留原始证据。"
      },
      {
        "id": "q3",
        "dimension": "implementation",
        "max_score": 25,
        "question": "提交真实工程结果。锚点：README.md、docs/architecture/、docs/adr/、docs/benchmark/。必须附复现步骤和至少一种证据：Git history、tests、benchmark/profile、ADR、v1.0 tag。"
      },
      {
        "id": "q4",
        "dimension": "diagnosis",
        "max_score": 25,
        "question": "从本节点真实运行中选择一个故障/边界，按观察→假设→证据→根因→修复→再验证完成诊断。"
      },
      {
        "id": "q5",
        "dimension": "transfer",
        "max_score": 20,
        "question": "把“把项目整理成可被 15~20k C++ 后端岗位追问和复现的技术作品：源码、测试、Benchmark、ADR、失败案例与面试叙事能够互相对应。”迁移到一个训练任务未原样出现的新场景，说明不变原则、需要调整的实现与取舍。"
      }
    ]
  },
  "retest_policy": {
    "reuse_initial_verification_for_failed_attempts": true,
    "new_paper_required_for_retest": true,
    "retest_paper_must_change_scenario": true
  }
}
